<?xml version="1.0" encoding="UTF-8"?>
<xs:schema xmlns:xs="http://www.w3.org/2001/XMLSchema">
    <xs:element name="salas">
        <xs:complexType>
            <xs:sequence>
                <xs:element name="sala" maxOccurs="unbounded">
                    <xs:complexType>
                        <xs:sequence>
                            <xs:element name="id" type="xs:int"/>
                            <xs:element name="nombre" type="xs:string"/>
                            <xs:element name="capacidad" type="xs:int"/>
                            <xs:element name="ubicacion" type="xs:string"/>
                            <xs:element name="tipo" type="xs:string"/>
                        </xs:sequence>
                    </xs:complexType>
                </xs:element>
            </xs:sequence>
        </xs:complexType>
    </xs:element>
</xs:schema>
